{"components":[{"component_id":"first-party:agent-workflow-pack","files":[],"install":{"modification":"first-party","target_root":"src/agent_stack"},"kind":"first-party","license_expression":"Apache-2.0","license_file":null,"modification_notice":{"sha256":"canonical-null","text":""},"name":"agent-workflow-pack","source":{"release_binding":"detached-manifest-source-commit","repository":"github.com/swl007007/agent-workflow-pack","type":"git-release","version_source":"pyproject.toml"},"version":"0.1.8"},{"component_id":"vendor:fastjsonschema","files":[{"installed_path":"src/agent_stack/_vendor/fastjsonschema/__init__.py","installed_sha256":"1b30b2c1695a9dd8d042c24b5da6641d8767c9d35c21317aaf6e00bf98106205","upstream_path":"fastjsonschema/__init__.py","upstream_sha256":"1b30b2c1695a9dd8d042c24b5da6641d8767c9d35c21317aaf6e00bf98106205"},{"installed_path":"src/agent_stack/_vendor/fastjsonschema/__main__.py","installed_sha256":"e217dddb7a6bcf199073c5632f47d4b1bb2bbef03bde02761c334f80b2c57402","upstream_path":"fastjsonschema/__main__.py","upstream_sha256":"e217dddb7a6bcf199073c5632f47d4b1bb2bbef03bde02761c334f80b2c57402"},{"installed_path":"src/agent_stack/_vendor/fastjsonschema/draft04.py","installed_sha256":"685866629d518f1ea60d9a219c19c27ddde03aa514ca5a505c2902940bd628f7","upstream_path":"fastjsonschema/draft04.py","upstream_sha256":"685866629d518f1ea60d9a219c19c27ddde03aa514ca5a505c2902940bd628f7"},{"installed_path":"src/agent_stack/_vendor/fastjsonschema/draft06.py","installed_sha256":"7123e77e5ab276be84578a74d93fe08785455fb99555da0a0b19cdc270bf3cf0","upstream_path":"fastjsonschema/draft06.py","upstream_sha256":"7123e77e5ab276be84578a74d93fe08785455fb99555da0a0b19cdc270bf3cf0"},{"installed_path":"src/agent_stack/_vendor/fastjsonschema/draft07.py","installed_sha256":"0f8a8d36159c8e0d13ac4887434049370be5cafd51a7c832101620441995d9bf","upstream_path":"fastjsonschema/draft07.py","upstream_sha256":"0f8a8d36159c8e0d13ac4887434049370be5cafd51a7c832101620441995d9bf"},{"installed_path":"src/agent_stack/_vendor/fastjsonschema/exceptions.py","installed_sha256":"c3be3d260a8a8bc72504570e6dd71b655aac985e2827f401ca16754866d414dc","upstream_path":"fastjsonschema/exceptions.py","upstream_sha256":"c3be3d260a8a8bc72504570e6dd71b655aac985e2827f401ca16754866d414dc"},{"installed_path":"src/agent_stack/_vendor/fastjsonschema/generator.py","installed_sha256":"6d866dfd07eb087fefeeb24304cb5e789c78503ca0115ed76633ad14bde2925b","upstream_path":"fastjsonschema/generator.py","upstream_sha256":"6d866dfd07eb087fefeeb24304cb5e789c78503ca0115ed76633ad14bde2925b"},{"installed_path":"src/agent_stack/_vendor/fastjsonschema/indent.py","installed_sha256":"8ee6455bd2d2be60c96cf148526dc63ea74fa89a149eabccf27787379ae4bf35","upstream_path":"fastjsonschema/indent.py","upstream_sha256":"8ee6455bd2d2be60c96cf148526dc63ea74fa89a149eabccf27787379ae4bf35"},{"installed_path":"src/agent_stack/_vendor/fastjsonschema/ref_resolver.py","installed_sha256":"3d69eefb6319cd61f9732983bdd72f5dfc7788e5bf32be9cfb15cc626f450fb4","upstream_path":"fastjsonschema/ref_resolver.py","upstream_sha256":"3d69eefb6319cd61f9732983bdd72f5dfc7788e5bf32be9cfb15cc626f450fb4"},{"installed_path":"src/agent_stack/_vendor/fastjsonschema/version.py","installed_sha256":"74d030c8a613a39f1d840f79ef5d352574d49d7cb59d1aaa7b0cad030c529843","upstream_path":"fastjsonschema/version.py","upstream_sha256":"74d030c8a613a39f1d840f79ef5d352574d49d7cb59d1aaa7b0cad030c529843"}],"install":{"modification":"namespace-relocation-only","target_root":"src/agent_stack/_vendor/fastjsonschema","upstream_root":"fastjsonschema"},"kind":"vendored-runtime","license_expression":"BSD-3-Clause","license_file":{"distribution_path":"LICENSES/fastjsonschema-2.21.1.txt","sha256":"9ccddf69eb3998a60148debe85b94c5afed53691b6474692e78abcc0a0e544f1","source_path":"vendor/licenses/fastjsonschema-2.21.1.txt"},"modification_notice":{"sha256":"0e90fd759c6e00e69bebd8d39dc3a027078903d494d45aef0e1dae77fdaf7f25","text":"fastjsonschema 2.21.1 is installed under the private namespace agent_stack._vendor.fastjsonschema; only that private namespace changed, and the registered source file bytes are unchanged."},"name":"fastjsonschema","source":{"archive_name":"fastjsonschema-2.21.1.tar.gz","sha256":"794d4f0a58f848961ba16af7b9c85a3e88cd360df008c59aac6fc5ae9323b5d4","url":"https://files.pythonhosted.org/packages/8b/50/4b769ce1ac4071a1ef6d86b1a3fb56cdc3a37615e8c5519e1af96cdac366/fastjsonschema-2.21.1.tar.gz"},"version":"2.21.1"},{"component_id":"vendor:pyyaml","files":[{"installed_path":"src/agent_stack/_vendor/yaml/__init__.py","installed_sha256":"377e52d351cc7ac1537b469144c5a43e3d0f6bc2046c7a44f452bb72be4176dc","upstream_path":"lib/yaml/__init__.py","upstream_sha256":"377e52d351cc7ac1537b469144c5a43e3d0f6bc2046c7a44f452bb72be4176dc"},{"installed_path":"src/agent_stack/_vendor/yaml/composer.py","installed_sha256":"fcaa37d16afa783594794a5ab94193dcb720f503c19ce3d59539c8311189f453","upstream_path":"lib/yaml/composer.py","upstream_sha256":"fcaa37d16afa783594794a5ab94193dcb720f503c19ce3d59539c8311189f453"},{"installed_path":"src/agent_stack/_vendor/yaml/constructor.py","installed_sha256":"90d8247da78b524c10618fd0e857f54f3d97570fe91b5c5513d024ef3faf88b0","upstream_path":"lib/yaml/constructor.py","upstream_sha256":"90d8247da78b524c10618fd0e857f54f3d97570fe91b5c5513d024ef3faf88b0"},{"installed_path":"src/agent_stack/_vendor/yaml/dumper.py","installed_sha256":"3cb72d66563064ba7b5e679477046ebf89d8399d940670c8532f3e94a7cb17ea","upstream_path":"lib/yaml/dumper.py","upstream_sha256":"3cb72d66563064ba7b5e679477046ebf89d8399d940670c8532f3e94a7cb17ea"},{"installed_path":"src/agent_stack/_vendor/yaml/emitter.py","installed_sha256":"8e086d694ede170837d5b1b407b45979aff6f40762f422a65eafd08e04290a44","upstream_path":"lib/yaml/emitter.py","upstream_sha256":"8e086d694ede170837d5b1b407b45979aff6f40762f422a65eafd08e04290a44"},{"installed_path":"src/agent_stack/_vendor/yaml/error.py","installed_sha256":"021f73fada072546c4f63f8cf18a7181244ce4280b09cc15cc980b2d1176171a","upstream_path":"lib/yaml/error.py","upstream_sha256":"021f73fada072546c4f63f8cf18a7181244ce4280b09cc15cc980b2d1176171a"},{"installed_path":"src/agent_stack/_vendor/yaml/events.py","installed_sha256":"e74fd392c810884e2ea7e94aa3f57e9c1cbeb402319083d0c58e6a0e1282787c","upstream_path":"lib/yaml/events.py","upstream_sha256":"e74fd392c810884e2ea7e94aa3f57e9c1cbeb402319083d0c58e6a0e1282787c"},{"installed_path":"src/agent_stack/_vendor/yaml/loader.py","installed_sha256":"5156becc8aa6905482218abf3e04869b835226db4763645fff3438fdbd5f1cdd","upstream_path":"lib/yaml/loader.py","upstream_sha256":"5156becc8aa6905482218abf3e04869b835226db4763645fff3438fdbd5f1cdd"},{"installed_path":"src/agent_stack/_vendor/yaml/nodes.py","installed_sha256":"80f28d8fca4a09d87677882bde021820d9cf39a3b11a12405226211919cf13ce","upstream_path":"lib/yaml/nodes.py","upstream_sha256":"80f28d8fca4a09d87677882bde021820d9cf39a3b11a12405226211919cf13ce"},{"installed_path":"src/agent_stack/_vendor/yaml/parser.py","installed_sha256":"8a55a9e6fbe0a07146cef3990c8b45a068c3e83e369e1959ad9ca30306b4a09a","upstream_path":"lib/yaml/parser.py","upstream_sha256":"8a55a9e6fbe0a07146cef3990c8b45a068c3e83e369e1959ad9ca30306b4a09a"},{"installed_path":"src/agent_stack/_vendor/yaml/reader.py","installed_sha256":"d1d9b38ab3a20c6e17a38d519ee412ecaf6b918df18c78956ac7c330d4ea08dc","upstream_path":"lib/yaml/reader.py","upstream_sha256":"d1d9b38ab3a20c6e17a38d519ee412ecaf6b918df18c78956ac7c330d4ea08dc"},{"installed_path":"src/agent_stack/_vendor/yaml/representer.py","installed_sha256":"22e58ff9c016f6c1ca1274b4802a926bcf78935060e1c813c5a0f021c6d143e6","upstream_path":"lib/yaml/representer.py","upstream_sha256":"22e58ff9c016f6c1ca1274b4802a926bcf78935060e1c813c5a0f021c6d143e6"},{"installed_path":"src/agent_stack/_vendor/yaml/resolver.py","installed_sha256":"f4bf9561f9b89961f1503d558385fbae30d12bfed565de9bf76c33abb63620a6","upstream_path":"lib/yaml/resolver.py","upstream_sha256":"f4bf9561f9b89961f1503d558385fbae30d12bfed565de9bf76c33abb63620a6"},{"installed_path":"src/agent_stack/_vendor/yaml/scanner.py","installed_sha256":"60433788b652690c17710460da5d91e0c753d3318fd85f5e1e42862a71f25906","upstream_path":"lib/yaml/scanner.py","upstream_sha256":"60433788b652690c17710460da5d91e0c753d3318fd85f5e1e42862a71f25906"},{"installed_path":"src/agent_stack/_vendor/yaml/serializer.py","installed_sha256":"0a1b85826854d35863e31808f0668abfabdf33606e8f06bd8bb7761401e3edc0","upstream_path":"lib/yaml/serializer.py","upstream_sha256":"0a1b85826854d35863e31808f0668abfabdf33606e8f06bd8bb7761401e3edc0"},{"installed_path":"src/agent_stack/_vendor/yaml/tokens.py","installed_sha256":"953408cd2570f0c83dc2fe39f7e4e388e41eeb05738aa69196a5f6ffcf6ba79e","upstream_path":"lib/yaml/tokens.py","upstream_sha256":"953408cd2570f0c83dc2fe39f7e4e388e41eeb05738aa69196a5f6ffcf6ba79e"}],"install":{"modification":"namespace-relocation-only","target_root":"src/agent_stack/_vendor/yaml","upstream_root":"lib/yaml"},"kind":"vendored-runtime","license_expression":"MIT","license_file":{"distribution_path":"LICENSES/PyYAML-6.0.2.txt","sha256":"8d3928f9dc4490fd635707cb88eb26bd764102a7282954307d3e5167a577e8a4","source_path":"vendor/licenses/PyYAML-6.0.2.txt"},"modification_notice":{"sha256":"1e7e0df3279ad3403b47f3984f554ac95360ef2200f2573348c8ce67d39aa189","text":"PyYAML 6.0.2 is installed under the private namespace agent_stack._vendor.yaml; only that private namespace changed, and the registered source file bytes are unchanged."},"name":"PyYAML","source":{"archive_name":"pyyaml-6.0.2.tar.gz","sha256":"d584d9ec91ad65861cc08d42e834324ef890a082e591037abe114850ff7bbc3e","url":"https://files.pythonhosted.org/packages/54/ed/79a089b6be93607fa5cdaedf301d7dfb23af5f25c398d5ead2525b063e17/pyyaml-6.0.2.tar.gz"},"version":"6.0.2"}],"projected_units":[{"definition_digest":"0b7e9a7a5e0b37bb16c58c99c85dc42fc488c4b60c5c6166a64fe15546807aa6","definition_path":"catalog/platforms.yaml","license_expression":"Apache-2.0","platform_adapter":"claude-code","